{
  "schema_version": "2.0",
  "report_type": "RESIDENT_MONTHLY",
  "subject": {
    "house_id": "1302",
    "batch_id": null,
    "period_label": "2026年7月"
  },
  "title": "1302 · 7月水电账单",
  "summary": "7月电费245.82元，比6月多用电168度，主要是天气更热、空调用得多。用水13.6吨，在同户型中偏多，主要花在淋浴上。把热水器改到夜间谷时加热，每月约可省21.6元。",
  "sections": [
    {
      "heading": "用电情况",
      "content": "本月用电486度，比6月的318度多了168度。空调用了231度，约占一半，7月平均气温31.4℃，比6月高4.3℃，空调多开是主要原因。整体用电在同户型中处于中等水平（百分位58）。",
      "highlights": [
        { "label": "本月电费", "value": "245.82元" },
        { "label": "用电量", "value": "486度" },
        { "label": "空调占比", "value": "48%" },
        { "label": "较上月", "value": "+168度" }
      ]
    },
    {
      "heading": "省钱建议",
      "content": "热水器有72度电是在峰时加热的，如果改为夜间谷时加热，每月约可省21.6元。家里夜间待机功率约0.11千瓦，可以检查电视机顶盒、电脑等是否长期待机。",
      "highlights": [
        { "label": "可转谷时", "value": "72度" },
        { "label": "每月可省", "value": "21.6元" }
      ]
    },
    {
      "heading": "用水情况",
      "content": "本月用水13.6吨，水费47.6元，比6月多1.5吨，在同户型同人数家庭中偏多（百分位72）。淋浴用了5.2吨，平均每次洗澡14.2分钟，比同类家庭多约5分钟；每天开热水前放掉的冷水约11.3升，可以接起来浇花或冲厕所。",
      "highlights": [
        { "label": "水费", "value": "47.6元" },
        { "label": "用水量", "value": "13.6吨" },
        { "label": "每次淋浴", "value": "14.2分钟" }
      ]
    },
    {
      "heading": "设备健康",
      "content": "7月12日提醒的花洒水垢问题已由您自行清理完成。空调、热水器、花洒健康状况良好（85-93分）。",
      "highlights": [
        { "label": "花洒", "value": "85分" },
        { "label": "热水器", "value": "93分" }
      ]
    },
    {
      "heading": "低碳贡献",
      "content": "本月用电折合碳排放约277.2千克。每少用10度电，约可减少5.7千克碳排放。",
      "highlights": [
        { "label": "碳排放", "value": "277.2千克" }
      ]
    }
  ],
  "actions": [
    {
      "type": "CREATE_AUTOMATION_RULE",
      "label": "热水器改谷时加热",
      "payload": { "house_id": "1302", "circuit": "热水器", "schedule": "VALLEY_ONLY" }
    },
    {
      "type": "VIEW_EVENT",
      "label": "查看花洒提醒",
      "payload": { "event_id": "EVT-20260712-1302-0007" }
    }
  ]
}
